{
  "schema": "playable.persona.v0",
  "persona_id": "persona:participant-01",
  "entity_id": "human:participant-01",
  "display_name": "Participant",
  "control_mode": "human",
  "avatar": {
    "kind": "glyph",
    "uri": null,
    "asset_ref": null
  },
  "voice": {
    "kind": "live",
    "profile_ref": null
  },
  "temporal_envelope": {
    "not_before": null,
    "not_after": null,
    "knowledge_cutoff": null
  },
  "disclosure": {
    "recording": "ask",
    "replay": "ask",
    "public_display": "ask"
  },
  "rights_refs": [],
  "provenance_refs": [],
  "notes": [
    "Protocol fixture identity only."
  ]
}
